{
  "protocol": "A",
  "name": "planowanie zmiany",
  "project": "sdlc",
  "agent": {
    "name": "Claude Opus 5",
    "sessions": [
      "session_01YDvBaqq1Ge24NRUkcQv5n3"
    ]
  },
  "started": "20260904T182000Z",
  "description": "Zaplanowanie wytycznej o przebiegach CI: pull requesty, prywatne submoduły, zależności.",
  "interactions": 5,
  "corrections": [],
  "measurements": {
    "plan_questions": {
      "definition": "pytania przedstawione właścicielowi",
      "value": 4
    },
    "question_rounds": {
      "definition": "zatrzymania na pytaniach",
      "value": 1
    },
    "closure_loops": {
      "definition": "przebiegi pętli domknięcia",
      "value": 2
    },
    "research_requests": {
      "definition": "pytania o zgodę na materiał badawczy",
      "value": 0
    },
    "gate_failures": {
      "definition": "przebiegi weryfikacji z wynikiem FAIL",
      "value": 1
    },
    "approval_rounds": {
      "definition": "przedstawienia projektu zmiany do zatwierdzenia",
      "value": 1
    }
  },
  "finished": "20260904T190342Z",
  "run_id": "eaf135c"
}
