{
  "protocol": "A",
  "name": "planowanie zmiany",
  "project": "sdlc",
  "agent": {
    "name": "Claude Opus 5",
    "sessions": [
      "session_01BDZEhun6hDMjq5Eg7Mpxda"
    ]
  },
  "started": "20260909T100154Z",
  "description": "Zaplanowanie katalogu .protocols.d z instancjami protokołu, listą kroków i commitem po kroku",
  "interactions": 8,
  "corrections": [
    {
      "kind": "zakres",
      "description": "Właściciel dołożył wynik weryfikacji do kroku przebiegu."
    }
  ],
  "measurements": {
    "approval_rounds": {
      "definition": "ile razy przedstawiono projekt zmiany do zatwierdzenia",
      "value": 2
    },
    "closure_loops": {
      "definition": "przebiegi pętli domknięcia",
      "value": 3
    },
    "gate_failures": {
      "definition": "przebiegi weryfikacji z wynikiem FAIL",
      "value": 1
    },
    "plan_questions": {
      "definition": "pytania przedstawione właścicielowi",
      "value": 4
    },
    "question_rounds": {
      "definition": "ile razy praca zatrzymała się na pytaniach",
      "value": 2
    },
    "research_requests": {
      "definition": "pytania o zgodę na oparcie się na materiale badawczym",
      "value": 0
    }
  },
  "finished": "20260909T110937Z"
}
