{
  "protocol": "B",
  "name": "realizacja projektu zmiany",
  "project": "sdlc",
  "agent": {
    "name": "Claude Opus 5",
    "sessions": [
      "session_01YDvBaqq1Ge24NRUkcQv5n3"
    ]
  },
  "started": "20260904T190400Z",
  "description": "Realizacja wytycznej o przebiegach CI wraz z decyzjami i zmianami w weryfikacji.",
  "interactions": 4,
  "corrections": [
    {
      "kind": "zakres",
      "description": "Właściciel zgodził się na klucze i sekrety w sdlc-devel, mimo sekcji Poza zakresem."
    }
  ],
  "measurements": {
    "steps_total": {
      "definition": "kroki wykonawcze zapisane w projekcie zmiany",
      "value": 10
    },
    "steps_deviated": {
      "definition": "kroki o wyniku rozjeżdżającym się z zapisanym",
      "value": 0
    },
    "plan_gaps": {
      "definition": "przypadki, w których projekt zmiany okazał się zły albo niepełny",
      "value": 1
    },
    "review_rounds": {
      "definition": "prośby o przegląd",
      "value": 1
    },
    "review_corrections": {
      "definition": "odpowiedzi poprawki w pętli przeglądu",
      "value": 0
    },
    "scope_conflicts": {
      "definition": "uwagi wykraczające poza sekcję Poza zakresem",
      "value": 0
    },
    "repositories_touched": {
      "definition": "repozytoria, które dostały commit",
      "value": 3
    },
    "gate_failures": {
      "definition": "przebiegi weryfikacji z wynikiem FAIL",
      "value": 0
    }
  },
  "finished": "20260904T191324Z"
}
