{
  "protocol": "A",
  "name": "planowanie zmiany",
  "project": "streamdeck-driver",
  "agent": {
    "name": "Claude Opus 5",
    "sessions": [
      "https://claude.ai/code/session_01JbA8pp4R9te6L62pt2sBLS"
    ]
  },
  "started": "20260907T081316Z",
  "description": "pełna konfiguracja panelu z GUI i z interfejsu webowego",
  "interactions": 5,
  "corrections": [],
  "measurements": {
    "approval_rounds": {
      "definition": "ile razy przedstawiono projekt zmiany do zatwierdzenia",
      "value": 1
    },
    "closure_loops": {
      "definition": "przebiegi pętli domknięcia",
      "value": 2
    },
    "gate_failures": {
      "definition": "przebiegi weryfikacji z wynikiem FAIL",
      "value": 2
    },
    "plan_questions": {
      "definition": "pytania przedstawione właścicielowi",
      "value": 4
    },
    "question_rounds": {
      "definition": "ile razy praca zatrzymała się na pytaniach",
      "value": 1
    },
    "research_requests": {
      "definition": "pytania o zgodę na oparcie się na materiale badawczym",
      "value": 0
    }
  },
  "finished": "20260907T092406Z"
}
