{
  "protocol": "C",
  "name": "prosta zmiana",
  "project": "sdlc",
  "description": "Podbicie wskaźnika procesu na scaloną gałąź główną",
  "started": "20260909T133957Z",
  "agent": {
    "name": "Claude Opus 5",
    "sessions": [
      "session_01BDZEhun6hDMjq5Eg7Mpxda"
    ]
  },
  "interactions": 1,
  "corrections": [],
  "measurements": {
    "escalations": {
      "definition": "ile razy praca wróciła do planowania, bo dotykała zachowania",
      "value": 0
    },
    "files_changed": {
      "definition": "zmienione pliki",
      "value": 1
    },
    "gate_failures": {
      "definition": "przebiegi weryfikacji z wynikiem FAIL",
      "value": 1
    },
    "owner_stops": {
      "definition": "zatrzymania po decyzję właściciela",
      "value": 0
    }
  },
  "finished": "20260909T134019Z"
}
