{
  "protocol": "D",
  "name": "przegląd inboxa",
  "project": "sdlc",
  "agent": {
    "name": "nieznany",
    "sessions": [
      "nieznana"
    ]
  },
  "started": "20260908T083321Z",
  "description": "przegląd wpisu o regule gałęzi dla produktu poza katalogiem src",
  "interactions": 1,
  "corrections": [],
  "measurements": {
    "entries_planned": {
      "definition": "wpisy skierowane do planowania",
      "value": 1
    },
    "entries_rejected": {
      "definition": "wpisy odrzucone",
      "value": 0
    },
    "entries_research": {
      "definition": "wpisy skierowane na rozpoznanie",
      "value": 0
    },
    "entries_reviewed": {
      "definition": "wpisy wzięte pod uwagę",
      "value": 1
    },
    "entries_simple": {
      "definition": "wpisy załatwione prostą zmianą",
      "value": 0
    },
    "owner_rounds": {
      "definition": "ile razy czekano na decyzję właściciela",
      "value": 1
    }
  },
  "finished": "20260908T083623Z"
}
