{
  "protocol": "A",
  "name": "planowanie zmiany",
  "project": "sdlc",
  "agent": {
    "name": "nieznany",
    "sessions": [
      "nieznana"
    ]
  },
  "started": "20260908T084444Z",
  "description": "wskazanie produktu konfiguracją zamiast stałej src w weryfikacji",
  "interactions": 2,
  "corrections": [],
  "measurements": {
    "approval_rounds": {
      "definition": "ile razy przedstawiono projekt zmiany do zatwierdzenia",
      "value": 1
    },
    "closure_loops": {
      "definition": "przebiegi pętli domknięcia",
      "value": 2
    },
    "gate_failures": {
      "definition": "przebiegi weryfikacji z wynikiem FAIL",
      "value": 1
    },
    "plan_questions": {
      "definition": "pytania przedstawione właścicielowi",
      "value": 3
    },
    "question_rounds": {
      "definition": "ile razy praca zatrzymała się na pytaniach",
      "value": 1
    },
    "research_requests": {
      "definition": "pytania o zgodę na oparcie się na materiale badawczym",
      "value": 0
    }
  },
  "finished": "20260908T102649Z"
}
